{
  "id": "vehicle.rideshare",
  "kind": "vehicle",
  "version": 1,
  "nameKey": "vehicle.rideshare",
  "render": {
    "asset": "vehicle/traffic.rideshare"
  },
  "physics": {
    "body": "dynamic",
    "shape": "box",
    "dims": [
      0.92,
      0.42,
      2.3
    ],
    "massKg": 1550,
    "groups": [
      "vehicle"
    ],
    "liftM": 0.6,
    "friction": 0.1,
    "restitution": 0.1,
    "angularDamping": 0.3,
    "ccd": true
  },
  "components": {
    "Transform": {
      "qw": 1
    },
    "Velocity": {},
    "BodyRef": {},
    "VehicleDamage": {
      "body": 1,
      "engine": 1,
      "tires": 1
    },
    "RenderKey": {
      "visible": 1
    }
  },
  "vehicle": {
    "handling": "hp.rideshare",
    "seats": 4,
    "wheels": [
      {
        "pos": [
          -0.78,
          0.05,
          -1.107
        ],
        "radius": 0.32,
        "restM": 0.28,
        "axle": "front"
      },
      {
        "pos": [
          0.78,
          0.05,
          -1.107
        ],
        "radius": 0.32,
        "restM": 0.28,
        "axle": "front"
      },
      {
        "pos": [
          -0.78,
          0.05,
          1.593
        ],
        "radius": 0.32,
        "restM": 0.28,
        "axle": "rear"
      },
      {
        "pos": [
          0.78,
          0.05,
          1.593
        ],
        "radius": 0.32,
        "restM": 0.28,
        "axle": "rear"
      }
    ]
  },
  "interact": {
    "kind": "EnterVehicle",
    "radius": 2.5,
    "promptKey": "interact.enterVehicle",
    "coneDeg": 180
  }
}
